<?xml version="1.0" encoding="UTF-8"?>
<?xml-stylesheet type="text/xsl" href="FlightDBStylesheet-ISHAQ.xsl"?>
<Airline
    xmlns:xsi="http://www.w3.org/2001/XMLSchema-instance" 
  xsi:noNamespaceSchemaLocation="FlightDBSchema.xsd " AirlineName="My Airline">
    <Passenger ID="_1">
        <FirstName>Dorris</FirstName>
        <LastName>Christiansen</LastName>
        <DateOfBirth>1980-08-17</DateOfBirth>
        <Nationality>Portugal</Nationality>
        <PassportNumber>815</PassportNumber>
    </Passenger>
    <Passenger ID="_2">
        <FirstName>Alvera</FirstName>
        <LastName>Ziemann</LastName>
        <DateOfBirth>2006-01-25</DateOfBirth>
        <Nationality>Bolivia</Nationality>
        <PassportNumber>441</PassportNumber>
    </Passenger>
    <Passenger ID="_3">
        <FirstName>Lonzo</FirstName>
        <LastName>Schmeler</LastName>
        <DateOfBirth>2003-10-28</DateOfBirth>
        <Nationality>Jordan</Nationality>
        <PassportNumber>274</PassportNumber>
    </Passenger>
    <Passenger ID="_4">
        <FirstName>Elijah</FirstName>
        <LastName>Walter</LastName>
        <DateOfBirth>2003-09-02</DateOfBirth>
        <Nationality>Wake Island</Nationality>
        <PassportNumber>79</PassportNumber>
    </Passenger>
    <Passenger ID="_6">
        <FirstName>Destany</FirstName>
        <LastName>Upton</LastName>
        <DateOfBirth>2017-11-08</DateOfBirth>
        <Nationality>Sierra Leone</Nationality>
        <PassportNumber>119</PassportNumber>
    </Passenger>
    <Passenger ID="_10">
        <FirstName>Gustave</FirstName>
        <LastName>Kohler</LastName>
        <DateOfBirth>2013-07-11</DateOfBirth>
        <Nationality>Denmark</Nationality>
        <PassportNumber>921</PassportNumber>
    </Passenger>
    <Passenger ID="_31">
        <FirstName>Alana</FirstName>
        <LastName>Kirlin</LastName>
        <DateOfBirth>2014-12-18</DateOfBirth>
        <Nationality>Guatemala</Nationality>
        <PassportNumber>239</PassportNumber>
    </Passenger>
    <Passenger ID="_32">
        <FirstName>Jeanne</FirstName>
        <LastName>Predovic</LastName>
        <DateOfBirth>1997-10-17</DateOfBirth>
        <Nationality>UnitedStates</Nationality>
        <PassportNumber>288</PassportNumber>
    </Passenger>
    <Passenger ID="_33">
        <FirstName>Francis</FirstName>
        <LastName>Crooks</LastName>
        <DateOfBirth>2015-03-18</DateOfBirth>
        <Nationality>Haiti</Nationality>
        <PassportNumber>549</PassportNumber>
    </Passenger>
    <Passenger ID="_34">
        <FirstName>Ignatius</FirstName>
        <LastName>Glover</LastName>
        <DateOfBirth>1995-05-30</DateOfBirth>
        <Nationality>Taiwan</Nationality>
        <PassportNumber>761</PassportNumber>
    </Passenger>
    <Passenger ID="_35">
        <FirstName>Nona</FirstName>
        <LastName>Gaylord</LastName>
        <DateOfBirth>2005-08-07</DateOfBirth>
        <Nationality>Vanuatu</Nationality>
        <PassportNumber>26</PassportNumber>
    </Passenger>
    <Passenger ID="_36">
        <FirstName>Gerard</FirstName>
        <LastName>Gibson</LastName>
        <DateOfBirth>2017-12-30</DateOfBirth>
        <Nationality>Singapore</Nationality>
        <PassportNumber>859</PassportNumber>
    </Passenger>
    <Employee ID="_37" Supervisor="_9" DepartmentID="_13">
        <FirstName>Colton</FirstName>
        <LastName>Considine</LastName>
        <DateOfBirth>1990-07-06</DateOfBirth>
        <Nationality>Bangladesh</Nationality>
        <PassportNumber>759</PassportNumber>
        <Salary>281223</Salary>
        <StartDate>2007-02-17</StartDate>
        <SSN>164-55-4210</SSN>
    </Employee>
    <Employee ID="_39" Supervisor="_9" DepartmentID="_13">
        <FirstName>Bridget</FirstName>
        <LastName>Lockman</LastName>
        <DateOfBirth>1995-05-03</DateOfBirth>
        <Nationality>Nigeria</Nationality>
        <PassportNumber>247</PassportNumber>
        <Salary>210315</Salary>
        <StartDate>1998-03-12</StartDate>
        <SSN>226-06-0050</SSN>
    </Employee>
    <Employee ID="_40" Supervisor="_9" DepartmentID="_13">
        <FirstName>Wilson</FirstName>
        <LastName>Abbott</LastName>
        <DateOfBirth>1991-11-18</DateOfBirth>
        <Nationality>Pakistan</Nationality>
        <PassportNumber>291</PassportNumber>
        <Salary>21697</Salary>
        <StartDate>2005-06-11</StartDate>
        <SSN>290-90-0602</SSN>
    </Employee>
    <Employee ID="_41" Supervisor="_9" DepartmentID="_13">
        <FirstName>Ruby</FirstName>
        <LastName>Kessler</LastName>
        <DateOfBirth>1996-06-07</DateOfBirth>
        <Nationality>Malaysia</Nationality>
        <PassportNumber>405</PassportNumber>
        <Salary>473205</Salary>
        <StartDate>1992-01-20</StartDate>
        <SSN>300-93-0009</SSN>
    </Employee>
    <Employee ID="_9" Supervisor="_1" DepartmentID="_12">
        <FirstName>Gunnar</FirstName>
        <LastName>Von</LastName>
        <DateOfBirth>2014-06-15</DateOfBirth>
        <Nationality>U.S.MinorOutlyingIslands</Nationality>
        <PassportNumber>755</PassportNumber>
        <Salary>792371</Salary>
        <StartDate>2000-08-11</StartDate>
        <SSN>070-10-0095</SSN>
    </Employee>
    <Employee ID="_5"  Supervisor="_9" DepartmentID="_13">
        <FirstName>Rhoda</FirstName>
        <LastName>Kohler</LastName>
        <DateOfBirth>1984-07-12</DateOfBirth>
        <Nationality>Yemen</Nationality>
        <PassportNumber>227</PassportNumber>
        <Salary>47774</Salary>
        <StartDate>2014-02-24</StartDate>
        <SSN>120-10-0007</SSN>
    </Employee>
    <Pilot ID="_8" CertificateNumber="81" Supervisor="_8" DepartmentID="_14">
        <FirstName>Gustave</FirstName>
        <LastName>Kohler</LastName>
        <DateOfBirth>2013-07-11</DateOfBirth>
        <Nationality>Denmark</Nationality>
        <PassportNumber>921</PassportNumber>
        <Salary>949854</Salary>
        <StartDate>2003-11-28</StartDate>
        <SSN>000-27-0000</SSN>
        <DateOfIssue>1996-10-31</DateOfIssue>
    </Pilot>
    <Pilot ID="_7" CertificateNumber="41" Supervisor="_8" DepartmentID="_14">
        <FirstName>Grace</FirstName>
        <LastName>Sanford</LastName>
        <DateOfBirth>1980-12-04</DateOfBirth>
        <Nationality>Indonesia</Nationality>
        <PassportNumber>297</PassportNumber>
        <Salary>222837</Salary>
        <StartDate>2007-07-04</StartDate>
        <SSN>000-58-2000</SSN>
        <DateOfIssue>1995-10-31</DateOfIssue>
    </Pilot>
    <Fare FareType="_21">
        <Fare>1000</Fare>
        <FareName>Economy</FareName>
    </Fare>
    <Fare FareType="_22">
        <Fare>1200</Fare>
        <FareName>Business</FareName>
    </Fare>
    <Fare FareType="_23">
        <Fare>1400</Fare>
        <FareName>First</FareName>
    </Fare>
    <Fare FareType="_24">
        <Fare>1600</Fare>
        <FareName>VIP</FareName>
    </Fare>
    <Flight FlightCode="F1">
        <Pilot>_8</Pilot>
        <Crew>_9</Crew>
        <DepartureTime>2012-06-30T19:00:00</DepartureTime>
        <ArrivalTime>2012-06-01T23:00:00</ArrivalTime>
        <Source>Dubai</Source>
        <Destination>United States</Destination>
        <Ticket PassengerID="_1"  FareType="_24">
            <SeatNumber>1</SeatNumber>
        </Ticket>
        <Ticket PassengerID="_6" FareType="_21">
            <SeatNumber>2</SeatNumber>
        </Ticket>
        <Ticket PassengerID="_4"  FareType="_21">
            <SeatNumber>3</SeatNumber>
        </Ticket>
        <Ticket PassengerID="_3" FareType="_22">
            <SeatNumber>4</SeatNumber>
        </Ticket>
        <Ticket PassengerID="_2" FareType="_22">
            <SeatNumber>5</SeatNumber>
        </Ticket>
        <Ticket PassengerID="_1" FareType="_23">
            <SeatNumber>6</SeatNumber>
        </Ticket>
        <Ticket PassengerID="_4" FareType="_23">
            <SeatNumber>7</SeatNumber>
        </Ticket>
        <Ticket PassengerID="_3"  FareType="_24">
            <SeatNumber>8</SeatNumber>
        </Ticket>
    </Flight>
    <Flight FlightCode="F2">
        <Pilot>_8</Pilot>
        <Pilot>_7</Pilot>
        <Crew>_9</Crew>
        <Crew>_37</Crew>
        <Crew>_41</Crew>
        <DepartureTime>2012-06-30T19:00:00</DepartureTime>
        <ArrivalTime>2012-06-01T23:00:00</ArrivalTime>
        <Source>Dubai</Source>
        <Destination>Tanzania</Destination>
        <Ticket PassengerID="_1"  FareType="_24">
            <SeatNumber>1</SeatNumber>
        </Ticket>
        <Ticket PassengerID="_6" FareType="_21">
            <SeatNumber>2</SeatNumber>
        </Ticket>
        <Ticket PassengerID="_4"  FareType="_21">
            <SeatNumber>3</SeatNumber>
        </Ticket>
        <Ticket PassengerID="_3" FareType="_22">
            <SeatNumber>4</SeatNumber>
        </Ticket>
        <Ticket PassengerID="_2" FareType="_22">
            <SeatNumber>5</SeatNumber>
        </Ticket>
        <Ticket PassengerID="_34" FareType="_23">
            <SeatNumber>6</SeatNumber>
        </Ticket>
        <Ticket PassengerID="_35" FareType="_23">
            <SeatNumber>7</SeatNumber>
        </Ticket>
        <Ticket PassengerID="_36"  FareType="_24">
            <SeatNumber>8</SeatNumber>
        </Ticket>
    </Flight>
    <Department Code="_11" Manager="_7">
        <Name>Passport Control</Name>
    </Department>
    <Department Code="_12" Manager="_7">
        <Name> Check In</Name>
    </Department>
    <Department Code="_13" Manager="_8">
        <Name> Duty Free</Name>
    </Department>
    <Department Code="_14" Manager="_8">
        <Name> Flight</Name>
    </Department>
</Airline>
